title,href,deadline,output
"Archaeological and Ethnographic Field Research","http://127.0.0.1:5500/program/archaeological-and-ethnographic-field-research","9/25/24","Report, Archaeological or Ethnographic Research"
"Collaborative Research","http://127.0.0.1:5500/grants/research/collaborative-research-grants","11/20/24","Digital Infrastructure (Software, Website, etc.)"
"Scholarly Editions and Translations","http://127.0.0.1:5500/grants/research/scholarly-editions-and-translations-grants","12/4/24",""
"Humanities Research Centers on Artificial Intelligence","http://127.0.0.1:5500/program/humanities-research-centers-artificial-intelligence","12/11/24","Curriculum Project, Digital Infrastructure (Software, Website, etc.), Conference, Workshop, Other Scholarly Resource"
"Awards for Faculty Institutional Support – HBCUs and TCUs","http://127.0.0.1:5500/program/awards-faculty-institutional-support-hbcus-and-tcus","2/3/25","Faculty/Staff Stipend or Short-term Hire"
"Fellowship Programs at Independent Research Institutions","http://127.0.0.1:5500/grants/research/fellowship-programs-independent-research-institutions","8/13/25","Fellowship"